{
  "schema_version": "ts-decision",
  "action": "end_node",
  "rationale": "Close pathway audit with a supported negative conclusion for the current mechanism branch.",
  "evidence_refs": [
    "${EV_PATHWAY_AUDIT}"
  ],
  "report_ref": {
    "report_id": "${REPORT_ID}",
    "workspace_root": "${WORKSPACE_ROOT}"
  },
  "payload": {
    "node_id": "n005",
    "closure": {
      "program_status": "completed",
      "claim_verdict": "supported",
      "reason_code": "pathway_not_accepted",
      "program": {
        "summary": "Pathway audit completed.",
        "evidence_refs": [
          "${EV_PATHWAY_AUDIT}"
        ]
      },
      "mechanism": {
        "summary": "The audit conclusion is negative: this branch does not strictly support the requested R to P pathway.",
        "hypothesis_ref": {
          "hypothesis_id": "${HYPOTHESIS_ID}",
          "prediction_ids": [
            "${PRED_PATHWAY_ID}"
          ]
        },
        "evidence_refs": [
          "${EV_PATHWAY_AUDIT}"
        ]
      },
      "implication": "Close this mechanism branch. Open a replacement branch only if a distinct scientifically meaningful hypothesis remains.",
      "open_questions": [
        "Is there an alternative atom mapping, conformer, or elementary-step hypothesis that should be tested?"
      ]
    }
  }
}
