{
  "schema_version": "ts-decision",
  "action": "end_node",
  "rationale": "Close hypothesis generation after recording a testable mechanism hypothesis and its uncertainty boundary.",
  "evidence_refs": [
    "${EV_NEW_HYPOTHESIS}"
  ],
  "report_ref": {
    "report_id": "${REPORT_ID}",
    "workspace_root": "${WORKSPACE_ROOT}"
  },
  "payload": {
    "node_id": "${NEW_HYPOTHESIS_NODE_ID}",
    "closure": {
      "program_status": "completed",
      "claim_verdict": "supported",
      "program": {
        "summary": "The new mechanism hypothesis was recorded with explicit predictions and uncertainties.",
        "evidence_refs": [
          "${EV_NEW_HYPOTHESIS}"
        ]
      },
      "mechanism": {
        "summary": "The new hypothesis is sufficiently specified for downstream testing; it is not yet chemically accepted.",
        "evidence_refs": [
          "${EV_NEW_HYPOTHESIS}"
        ]
      },
      "implication": "Open a hypothesis-referenced candidate-generation or validation node.",
      "open_questions": [
        "The hypothesis remains untested until its declared predictions receive evidence."
      ]
    }
  }
}
