{
  "schema_version": "ts-decision",
  "action": "start_node",
  "rationale": "Start IRC or equivalent connectivity validation for the TS/Freq-supported candidate.",
  "evidence_refs": [
    "${EV_TSFREQ}"
  ],
  "report_ref": {
    "report_id": "${REPORT_ID}",
    "workspace_root": "${WORKSPACE_ROOT}"
  },
  "payload": {
    "node_id": "n003",
    "parent_node": "n002",
    "phase": "connectivity_validation",
    "hypothesis": "IRC endpoints or validated displacement endpoints connect the candidate to the expected reactant and product basins.",
    "hypothesis_ref": {
      "hypothesis_id": "${HYPOTHESIS_ID}",
      "prediction_ids": [
        "${PRED_CONN_ID}"
      ]
    },
    "branch_context": {
      "relation": "continue_parent",
      "from_node": "n002",
      "anchor_node": "n000"
    },
    "pathway_ref": {
      "pathway_id": "${PATHWAY_ID}",
      "step_id": "${STEP_ID}"
    },
    "expected_evidence": [
      "irc_output",
      "connectivity_gate",
      "irc_endpoint_assignment"
    ]
  }
}
