{
  "schema_version": "ts-decision",
  "action": "end_node",
  "rationale": "Close connectivity validation with supported R/P endpoint assignments.",
  "evidence_refs": [
    "${EV_CONNECTIVITY}"
  ],
  "report_ref": {
    "report_id": "${REPORT_ID}",
    "workspace_root": "${WORKSPACE_ROOT}"
  },
  "payload": {
    "node_id": "n003",
    "closure": {
      "program_status": "completed",
      "claim_verdict": "supported",
      "program": {
        "summary": "IRC or endpoint-assignment analysis completed.",
        "evidence_refs": [
          "${EV_CONNECTIVITY}"
        ]
      },
      "mechanism": {
        "summary": "Connectivity evidence supports the expected R to P assignment for the active hypothesis.",
        "hypothesis_ref": {
          "hypothesis_id": "${HYPOTHESIS_ID}",
          "prediction_ids": [
            "${PRED_CONN_ID}"
          ]
        },
        "evidence_refs": [
          "${EV_CONNECTIVITY}"
        ]
      },
      "implication": "Run accepted-TS audit using both TS/Freq and connectivity gates.",
      "open_questions": []
    }
  }
}
