{
  "schema_version": "ts-decision",
  "action": "end_node",
  "rationale": "Close pathway audit with an accepted R to P pathway conclusion.",
  "evidence_refs": [
    "${EV_PATHWAY_AUDIT}",
    "${EV_MECHANISM_REFLECTION}"
  ],
  "report_ref": {
    "report_id": "${REPORT_ID}",
    "workspace_root": "${WORKSPACE_ROOT}"
  },
  "payload": {
    "node_id": "n005",
    "closure": {
      "program_status": "completed",
      "claim_verdict": "supported",
      "program": {
        "summary": "Pathway audit completed.",
        "evidence_refs": [
          "${EV_PATHWAY_AUDIT}",
          "${EV_MECHANISM_REFLECTION}"
        ]
      },
      "mechanism": {
        "summary": "The audit conclusion is accepted: the evidence supports the requested R to P pathway.",
        "hypothesis_ref": {
          "hypothesis_id": "${HYPOTHESIS_ID}",
          "prediction_ids": [
            "${PRED_PATHWAY_ID}"
          ]
        },
        "evidence_refs": [
          "${EV_PATHWAY_AUDIT}",
          "${EV_MECHANISM_REFLECTION}"
        ]
      },
      "implication": "The audited pathway may be reported as accepted.",
      "open_questions": []
    }
  }
}
